id,brand,category,name,size,rating,number_of_reviews,love,price,value_price,URL,MarketingFlags,MarketingFlags_content,options,details,how_to_use,ingredients,online_only,exclusive,limited_edition,limited_time_offer,Fam_Category,Shades
2036408,Anastasia Beverly Hills,Lipstick,Liquid Lipstick,0.11 oz / 3.2 g,4.0,4000,549000,20.0,20.0,https://www.sephora.com/product/liquid-lipstick-P404831?icid2=products grid:p404831,False,0,no options,What it is: A full-pigment- matte formula that dries to a weightless powder for smudge-proof wearability.What it does: Liquid Lipstick delivers ultra-saturated- full coverage pigment in a wearable matte formula. The rounded applicator makes both lining and applying lip color effortless.What it is formulated WITHOUT:- Parabens- Sulfates- PhthalatesBeauty Tip:Mix two or more shades together for a custom lip shade.,Suggested Usage:-Begin by applying Liquid Lipstick to the center of the lower lip and working out- toward the lip line.-Repeat by applying to the center of the upper lip and working toward the lip line.-To perfect your look- apply Pro Pencil (sold separately) around the perimeter of the lips and blend with Brush 20- or use Brush 3 (both brushes sold separately) to create clean edges.,Isododecane- Trimethylsiloxysilicate- Boron Nitride- Nylon-12- Ozokerite- Mineral Oil- Disteardimonium Hectorite- Butylene/Ethylene/Styrene Copolymer- Ethylene/Propylene/Styrene Copolymer- Isohexadecane- Phenoxyethanol- Propylene Carbonate- Sodium Hyaluronate- Sodium Magnesium Silver Phosphate- Tocopheryl Acetate- Tripeptide-1- Xanthan Gum. May Contain (+/-): Red 7 Lake (Ci 15850)- Red 6 (Ci 15850)- Yellow 5 Lake (Ci 19140)- Red 22 Lake (Ci 45380)- Red 27 Lake (Ci 45410)- Iron Oxides (Ci 77491- Ci 77492- Ci 77499)- Titanium Dioxide (Ci 77891).,0,0,0,0,Makeup,Ashton - midtone yellow brown  Naked - light peachy nude  Stripped - neutral beige nude  Crush - soft beige  Kathryn - brown berry  Pure Hollywood - pale mauve nude  Dusty Rose   Craft - sangria  Trust Issues - dusty aubergine  Vintage - rich vibrant berry  Madison - vibrant plum magenta  American Doll - classic blue red   Sarafine - deep blue red  Heathers - brownish oxblood  Veronica - taupe mauve  Sepia - dark yellow taupe  Trouble  Limited Edition Grim - greige  Maude - cedar brown  Hudson - faded terracotta  Malt - chocolate brown  Dazed - redwood  Poet - dusty mauve  Bohemian - cedar brown  Reqiuem - metallic blackened teal  Ashton - midtone yellow brown  Naked - light peachy nude  Stripped - neutral beige nude  Crush - soft beige  Kathryn - brown berry  Pure Hollywood - pale mauve nude  Dusty Rose   Craft - sangria  Trust Issues - dusty aubergine  Vintage - rich vibrant berry  Madison - vibrant plum magenta  American Doll - classic blue red   Sarafine - deep blue red  Heathers - brownish oxblood  Veronica - taupe mauve  Sepia - dark yellow taupe  Trouble  Limited Edition Grim - greige  Maude - cedar brown  Hudson - faded terracotta  Malt - chocolate brown  Dazed - redwood  Poet - dusty mauve  Bohemian - cedar brown  Reqiuem - metallic blackened teal 
1962695,Anastasia Beverly Hills,Lipstick,Matte Lipstick,.12 oz/ 3.5 g,4.5,818,112900,18.0,18.0,https://www.sephora.com/product/matte-lipstick-P422512?icid2=products grid:p422512,False,0,no options,What it is:A full-pigment lip color with a smooth- ultra-matte finish.What it does: Get beautiful- classic matte lips in a flash with this highly-pigmented lipstick. Matte Lipstick provides a soft- elegant- and lasting finish in enough shades to satisfy any lip aficionado. The comfortable- matte formula is now available in six new nude shades.What it is formulated WITHOUT:- Parabens- Sulfates- PhthalatesWhat else you need to know: To create a lacquer finish- pair with Lip Gloss (sold separately). For a metallic finish- pair with Glow Kit (sold separately).,Suggested Usage:-Using Brush 3 (sold separately)- work directly off Matte Lipstick to define the lip line or detail the lips.-For on-the-go touch ups- perfect the perimeter of the lips using Pro Pencil (sold separately).-To create the look of volume- apply a lighter shade of Matte Lipstick in the center of the lips or top with Lip Gloss (sold separately).,Caprylic/Capric Triglyceride- Octyldodecanol- Isononyl Isononanoate- Bis-Diglyceryl Polyacyladipate-2- Polyglyceryl-2 Triisostearate- Nylon-12- Pentaerythrityl Tetrabehenate- Polyethylene- Synthetic Wax- Kaolin- Hydrogenated Microcrystalline Wax/Cire Microcristalline/Cera Microcristallina- Ozokerite- Pentaerythrityl Tetra-Di-T-Butyl Hydroxyhydrocinnamate- Simmondsia Chinensis (Jojoba) Seed Oil- Sodium Magnesium Silver Phosphate- Tocopheryl Acetate- Triethoxycaprylylsilane- May Contain(+/-): Mica- Red 7 Lake (Ci 15850)- Red 6 (Ci 15850)- Yellow 5 Lake (Ci 19140)- Blue 1 Lake (Ci 42090)- Red 27 Lake (Ci 45410)- Iron Oxides (Ci 77491- Ci 77492- Ci 77499)- Titanium Dioxide (Ci 77891).,0,0,0,0,Makeup,Staunch - nude sandy pink  Dusty Mauve - antique heathered lilac  Rogue - muted redwood   Cool Brown - warm cocoa brown  Rosewood - muted cherrywood  Buff - nude salmon pink  Rust - rich raisin brown  Ruby - classic red  Kiss - nude rose petal pink  Latte - muted blushing brown  Soft Pink - blushing petal pink  Dead Roses - blushing mauve  Rum Punch - ripened plumberry  Resin - rosey mauve  Stargazer - hibiscus pink  Plumeria - punchy orchid  Rage - vivid grape  Petal - rosy pale pink  Sweet Pea - light cool-toned pink Out of Stock Hollywood - pale peach  Nude - muted burnt orange  Soft Touch - light rose taupe  Sedona - pale terracotta  Staunch - nude sandy pink  Dusty Mauve - antique heathered lilac  Rogue - muted redwood   Cool Brown - warm cocoa brown  Rosewood - muted cherrywood  Buff - nude salmon pink  Rust - rich raisin brown  Ruby - classic red  Kiss - nude rose petal pink  Latte - muted blushing brown  Soft Pink - blushing petal pink  Dead Roses - blushing mauve  Rum Punch - ripened plumberry  Resin - rosey mauve  Stargazer - hibiscus pink  Plumeria - punchy orchid  Rage - vivid grape  Petal - rosy pale pink  Sweet Pea - light cool-toned pink Out of Stock Hollywood - pale peach  Nude - muted burnt orange  Soft Touch - light rose taupe  Sedona - pale terracotta 
1941970,Anastasia Beverly Hills,Eyeshadow,Eye Shadow Singles,0.059 oz/ 1.67 g,4.5,687,565200,12.0,12.0,https://www.sephora.com/product/eye-shadow-singles-P404832?icid2=products grid:p404832,False,0,no options,"What it is:
A finely-milled- full pigment- eyeshadow formula in five finishes: glitter- matte- metallic- satin- and shimmer.



What it does:
 These Eye Shadow Singles feature five deluxe finishes in full-pigment- buildable formulas. Each eyeshadow offers customizable bundling options of four and five shades. Create a custom palette with the Empty 4 Well Refillable Eye Palette that holds four pans of your favorite colors and textures.


What else you need to know:
""With dozens of colors and textures to choose from- the combinations are truly endless.""—Anastasia Soare



Just wet an eyeshadow brush for an intense cream shadow finish. All Eyeshadows come in individually packaged refill sleeves. 


","Precautions:
-Store in a cool- dry place.","Boron Nitride- Dimethicone- Nylon-12- Zinc Stearate- Octyldodecyl Stearoyl Stearate- Polymethylsilsesquioxane- Zea Mays (Corn) Starch- Zinc Myristate- Glycerin- Silica- Vinyl Dimethicone/Methicone Silsesquioxane Crosspolymer- Aluminum Calcium Sodium Silicate- Beeswax/Cera Alba/Cire D'abeille- Caprylyl Glycol- Cyclopentasiloxane- Hydrogenated Lecithin- Isopentyldiol- Lauroyl Lysine- Mineral Oil- Phenoxyethanol- Polysilicone-11- Sodium Polyacrylate- Synthetic Fluorphlogopite- Theobroma Cacao (Cocoa) Seed Butter- Tin Oxide- Tocopherol- May Contain: (+/-) Mica- Carmine (Ci 75470)- Iron Oxide (Ci 77491)- Ferric Ferrocyanide (Ci 77510)- Titanium Dioxide (Ci 77891).
*Contains Carmine as a color additive ",0,0,0,0,Makeup,Pink Champagne - pinky beige shimmer (titanium)  Rosette - burgundy shimmer (titanium)  Truffle Glitter - brown with burgundy shimmer (titanium)  Dragonfly - iridescent blue with purple reflect (duo chrome)  Baby Cakes - pastel pink (ultra-matte)  Emerald - rich forest green (metallic)  Glisten - shimmery beige (metallic)  Birkin - warm beige mauve (ultra-matte)  Burnt Orange Matte - deep orange (ultra-matte)  Deep Plum - deep purple (ultra-matte)  Fresh - ivory pink (ultra-matte)  Hot Chocolate - warm dark brown (ultra-matte)  Noir - deep carbon black (ultra-matte)  Orange Soda - pastel peach (ultra-matte)  Red Earth - reddish brown (ultra-matte)  Stone - light ash grey (ultra-matte)  Warm Taupe - warm soft brown (ultra-matte)  Buon Fresco - antique lavender (ultra-matte)  Love Letter - raspberry (ultra-matte)  Blazing - brick red (ultra-matte)  Legend - buttery gold with white reflect (shimmer)  Dusty Rose - dusty lilac (ultra-matte)  Rose Gold - pink coral (duo chrome)  Gemstone - violet orchid (duo chrome)  Tiger's eye - patina gold (duo chrome)  Sunset - copper penny (metallic)  Venice - turquoise (duo chrome)  Ballet - seashell pink (metallic)  Enchanted - royal purple (duo chrome)  Sangria - iridescent cranberry (satin)  Vermeer - metallic pearl (metallic)  Pink Champagne - pinky beige shimmer (titanium)  Rosette - burgundy shimmer (titanium)  Truffle Glitter - brown with burgundy shimmer (titanium)  Dragonfly - iridescent blue with purple reflect (duo chrome)  Birkin - warm beige mauve (ultra-matte)  Burnt Orange Matte - deep orange (ultra-matte)  Deep Plum - deep purple (ultra-matte)  Fresh - ivory pink (ultra-matte)  Hot Chocolate - warm dark brown (ultra-matte)  Noir - deep carbon black (ultra-matte)  Orange Soda - pastel peach (ultra-matte)  Red Earth - reddish brown (ultra-matte)  Stone - light ash grey (ultra-matte)  Warm Taupe - warm soft brown (ultra-matte)  Baby Cakes - pastel pink (ultra-matte)  Blazing - brick red (ultra-matte)  Emerald - rich forest green (metallic)  Glisten - shimmery beige (metallic)  Sangria - iridescent cranberry (satin)  Legend - buttery gold with white reflect (shimmer)  Dusty Rose - dusty lilac (ultra-matte)  Buon Fresco - antique lavender (ultra-matte)  Rose Gold - pink coral (duo chrome)  Gemstone - violet orchid (duo chrome)  Tiger's eye - patina gold (duo chrome)  Sunset - copper penny (metallic)  Love Letter - raspberry (ultra-matte)  Vermeer - metallic pearl (metallic)  Venice - turquoise (duo chrome)  Ballet - seashell pink (metallic)  Enchanted - royal purple (duo chrome) 
2093565,Anastasia Beverly Hills,Lip Gloss,Lip Gloss,0.16 oz/ 4.73 mL,4.5,1000,208100,16.0,16.0,https://www.sephora.com/product/lip-gloss-P404830?icid2=products grid:p404830,False,0,no options,"What it is:
 A fully-pigmented- weightless lip gloss formula in lacquer and luster finishes.

What it does:
 This ultra-pigmented lip lacquer delivers a mirror-like gloss finish. Its round- flexible applicator ensures precise application.

What it is formulated WITHOUT:
- Sulfates
- Phthalates

What else you need to know:
Layer on top of Liquid Lipstick for a hydrated finish.
","Precautions:
-Store in a cool- dry place.",Polybutene- Octyldodecanol- Hydrogenated Polyisobutene- Isononyl Isononanoate- Silica Dimethyl Silylate- Dicaprylyl Carbonate- Glycolipids- Vp/Hexadecene Copolymer- Calcium Sodium Borosilicate- Calcium Titanium Borosilicate- Limnanthes Alba (Meadowfoam) Seed Oil- Silica- Simmondsia Chinensis (Jojoba) Seed Oil- Sodium Magnesium Silver Phosphate- Synthetic Fluorphlogopite- Tin Oxide- Tocopheryl Acetate- Fragrance/Parfum- May Contain/Peut Contenir (+/-): Mica- Red 6 (Ci 15850)- Red 27 Lake (Ci 45410)- Titanium Dioxide (Ci 77891).,0,0,0,0,Makeup,Gilded - sparkly antique gold  St.Tropez  Out of Stock Parfait   Undressed - café au lait  Kristen - cool desert sand  Tara - earthy terracotta brown  Sepia - warm reddish brown  Peony - chic baby pink  Metallic Rose - shimmery dusty rose  Vintage - victorian rose  Toffee  Out of Stock Carmel   Freya - dazzling gold & pink reflective sparkle  Estella - celestial cluster of gold & blue reflective sparkles  Sunscape - duo chrome peach gold kaleidoscopic sparkle  Luna - multi-reflective gold  Venus - dazzling gold & pink reflective sparkle  Warm Bronze - intense dusty rose  Girly  Out of Stock Moon Jelly  Out of Stock Gilded - sparkly antique gold  Undressed - café au lait  Kristen - cool desert sand  Tara - earthy terracotta brown  Sepia - warm reddish brown  Warm Bronze - intense dusty rose  Peony - chic baby pink  Metallic Rose - shimmery dusty rose  Vintage - victorian rose  St.Tropez  Out of Stock Toffee  Out of Stock Parfait   Girly  Out of Stock Carmel   Moon Jelly  Out of Stock Freya - dazzling gold & pink reflective sparkle  Estella - celestial cluster of gold & blue reflective sparkles  Sunscape - duo chrome peach gold kaleidoscopic sparkle  Luna - multi-reflective gold  Venus - dazzling gold & pink reflective sparkle 
1307859,CLINIQUE,Lip Balm & Treatment,Chubby Stick Moisturizing Lip Colour Balm,0.1 oz/ 3 g,4.5,2000,77700,18.5,18.5,https://www.sephora.com/product/chubby-stick-moisturizing-lip-colour-balm-P279113?icid2=products grid:p279113,False,0,no options,"What it is: 
A nourishing tinted lip balm that is part of a limited-edition collection.
What Else You Need to Know: Get vibrant- nourishing color with Clinique’s Crayola™ Chubby Sticks—loaded with mango and shea butters so that lips feel comfortably soft and smooth. This product is offered in sheer to intense shades including Wild Strawberry (Chunky Cherry)- Pink Sherbert (woppin' watermelon)- Mauvelous (super strawberry)- Mango Tango (oversized orange)- Melon (mighty mimosa)- Razzmatazz (pudgy peony)- Tickle Me Pink (intense)- Red Violet (intense)- Fuzzy Wuzzy (intense)- Brick Red (intense).
",Suggested Usage:-Apply directly to lips.-For subtle definition- outline lips first- then fill in with natural-looking color.,Ricinus Communis (Castor) Seed Oil - Caprylic/Capric Triglyceride - Vegetable Oil/Olus/Huile Vegetale - Euphorbia Cerifera (Candelilla) Wax/Candelilla Cera/Cire De Candelilla - Beeswax/Cera Alba/Cire D Abeille - Ozokerite - Butyrospermum Parkii (Shea Butter) - Hydrogenated Vegetable Oil - Simmondsia Chinensis (Jojoba) Seed Oil - Tocopherol - Mangifera Indica (Mango) Seed Butter - Limnanthes Alba (Meadowfoam) Seed Oil - Hydrogenated Olive Oil - Helianthus Annuus (Sunflower) Seed Oil -  [+/- Titanium Dioxide (Ci 77891) - Mica - Yellow 5 Lake (Ci 19140) - Iron Oxides (Ci 77491- Ci 77492- Ci 77499) - Red 7 Lake (Ci 15850) - Red 22 Lake (Ci 45380) - Red 30 Lake (Ci 73360) - Carmine (Ci 75470) - Red 6 (Ci 15850) - Bismuth Oxychloride (Ci 77163) - Red 33 Lake (Ci 17200) - Red 28 Lake (Ci 45410) - Blue 1 Lake (Ci 42090) - Yellow 6 Lake (Ci 15985)] ,0,0,0,0,Makeup,Bountiful Blush - sheer dusty rose  Chunky Cherry - sheer cherry red  Curvy Candy - sheer bubblegum pink  Fuller Fig - sheer pinky beige  Graped Up - sheer plum beige  Heaping Hazelnut - sheer nude  Mega Melon - sheer peachy pink  Mighty Mimosa - sheer natural pink  Pudgy Peony - sheer fuchsia  Richer Raisin - sheer plum brown  Super Strawberry - sheer berry pink  Two Ton Tomato - sheer warm red  Voluptuous Violet - sheer plum violet  Whole Lotta Honey - sheer warm beige  Woppin Watermelon - sheer pink  Bountiful Blush - sheer dusty rose  Chunky Cherry - sheer cherry red  Curvy Candy - sheer bubblegum pink  Fuller Fig - sheer pinky beige  Graped Up - sheer plum beige  Heaping Hazelnut - sheer nude  Mega Melon - sheer peachy pink  Mighty Mimosa - sheer natural pink  Pudgy Peony - sheer fuchsia  Richer Raisin - sheer plum brown  Super Strawberry - sheer berry pink  Two Ton Tomato - sheer warm red  Voluptuous Violet - sheer plum violet  Whole Lotta Honey - sheer warm beige  Woppin Watermelon - sheer pink 
2327245,FENTY BEAUTY by Rihanna,Lip Gloss,Gloss Bomb Universal Lip Luminizer,0.3 oz/ 9 mL,4.5,10000,553300,19.0,19.0,https://www.sephora.com/product/gloss-bomb-universal-lip-luminizer-P67988453?icid2=products grid:p67988453,True,exclusive,no options,What it is: An ultimate- gotta-have-it lip gloss with explosive shine that feels as good as it looks.Highlighted Ingredients: - Shea Butter: Conditions skin. Ingredient Callouts: Free of parabens and phthalates. This product is also cruelty-free.What Else You Need to Know: This universal lip luminizer delivers explosive shine in six shades that flatter all skin tones. One swipe of Gloss Bomb’s XXL wand leaves lips looking instantly fuller and smoother. The non-sticky formula is super shiny- and has an addictive peach-vanilla scent you just can't get enough of. Rihanna was obsessed with creating the perfect gloss that makes you want to put it on over and over again. “I made it because I wanted the girls to get kissed more.”—Rihanna- Brand Founder,Suggested Usage:-Wear Gloss Bomb alone or layer over lipstick as the finishing touch to the FENTY Face.-Artistry Pro Tip:  Try Gloss Bomb over your favorite lip color for super-lustrous dimension.,Polybutene- Octyldodecanol- Bis-Diglyceryl Polyacyladipate-2- Tricaprylin- Microcrystalline Wax- Polyethylene- Silica Dimethyl Silylate- Vp/Eicosene Copolymer- Vp/Hexadecene Copolymer- Butyrospermum Parkii (Shea) Butter- Sorbitan Oleate- Silica- Octyldodecyl Neopentanoate- Ethylhexyl Palmitate- Calcium Sodium Borosilicate- Mica- Caprylyl Glycol- Butyrospermum Parkii (Shea) Butter Unsaponifiables- Aroma/Flavor- Benzyl Benzoate- Tribehenin- Pentaerythrityl Tetra-Di-T-Butyl Hydroxyhydrocinnamate- Fragrance- Tocopherol- Tocopheryl Acetate- Sorbitan Isostearate- Limonene- Synthetic Fluorphlogopite- Tetrahexyldecyl Ascorbate- Lactic Acid- Tin Oxide- Calcium Aluminum Borosilicate- Polyethylene Terephthalate- Palmitoyl Tripeptide-1- Acrylates Copolymer- Red 7 Lake (Ci 15850)- Iron Oxides (Ci 77499- Ci 77491)- Titanium Dioxide (Ci 77891).,0,1,0,0,Makeup,Glass Slipper - clear  $weetmouth - shimmering soft pink  Hot Chocolit - shimmering rich brown  Diamond Milk - shimmering pearl  FU$$Y - shimmering pink  Fenty Glow - shimmering rose nude  Glass Slipper - clear  $weetmouth - shimmering soft pink  Hot Chocolit - shimmering rich brown  Diamond Milk - shimmering pearl  FU$$Y - shimmering pink  Fenty Glow - shimmering rose nude 
2156487,FENTY BEAUTY by Rihanna,Lipstick,Mattemoiselle Plush Matte Lipstick,0.06 oz/ 1.7 g,4.5,2000,349300,18.0,18.0,https://www.sephora.com/product/mattemoiselle-plush-matte-lipstick-P45874456?icid2=products grid:p45874456,True,exclusive,no options,"What it is: An ultra-slim lipstick with a long-wearing- petal-soft matte finish- created in a rainbow of weightless- color-intense shades designed to flatter all skin tones.What it does: Rep every mood in full-on color. High-octane pigment meets unexpectedly universal shades to complement all moods- all skin tones- all day. Whether you’re looking for the perfect red- everyday nude- or moody blue- Mattemoiselle Plush Matte Lipstick makes it easier than ever to rock the entire rainbow.Rihanna wanted to make the matte lipstick of your dreams a reality: Think mega rich color minus the weight. The ultimate light-as-air texture glides on creamy and stays put—no bleeding or feathering after application—with a velvety-soft matte finish inspired by a rose petal. And thanks to Mattemoiselle’s chic- slim design- you can effortlessly define lips with the ultimate control for lips that look fuller with every stroke.What it is formulated WITHOUT:- Parabens- Sulfates- PhthalatesWhat else you need to know:Rihanna loves changing up her lipstick to suit her current mood- so she wanted to create a lipstick collection that would empower everyone to explore new looks. She hand-picked a range of shades that anyone can pull off- with names that embody the personality of each color. ""Lipstick is all about having fun and expressing your mood at any given moment. This collection makes it easier than ever because there's a color for everyone.""—Rihanna Fenty Beauty is 100 percent cruelty-free.The shade Clapback is an Allure Best of Beauty award winner.","Suggested Usage:
Mattemoiselle was designed to vibe with your skin tone. No more guesswork—just swipe on and go.
",Octyldodecanol- Polyethylene- Candelilla Cera/Euphorbia Cerifera (Candelilla) Wax/Cire De Candelilla- Aluminum Starch Octenylsuccinate- Silica- Microcrystalline Wax- Isodecyl Neopentanoate-  Hydrogenated Polycyclopentadiene- Isohexadecane- Isononyl Isononanoate- Mica- Lecithin- Polyglyceryl-3 Diisostearate- Polymethyl Methacrylate- Dimethicone/Bis-Isobutyl Ppg-20 Crosspolymer- Tocopherol- Tocopheryl Acetate- Tetrahexyldecyl Ascorbate- Passiflora Edulis Seed Oil- Cera Carnauba/Copernicia Cerifera Cera (Carnauba) Wax/Cire De Carnauba- Water- Disteardimonium Hectorite- Octyldodecyl Neopentanoate- Propylene Carbonate- Sodium Hyaluronate- Caprylyl Glycol- Calcium Sodium Borosilicate- Synthetic Fluorphlogopite- Calcium Aluminum Borosilicate- Polyethylene Terephthalate- Acrylates Copolymer- Tin Oxide. May Contain (+/-): Red 7 Lake (Ci 15850)- Red 28 Lake (Ci 45410)- Yellow 5 Lake (Ci 19140)- Titanium Dioxide (Ci 77891)- Blue 1 Lake (Ci 42090)- Iron Oxides (Ci 77499- Ci 77492- Ci 77491)- Red 6 (Ci 15850)- Yellow 6 Lake (Ci 15985).,0,1,0,0,Makeup,Spanked - dusty rose Out of StockSale Thicc - sultry mauve Out of StockSale Dragon Mami - tropical papaya Sale Ma'Damn - royal red Out of StockSale Flamingo Acid - bright berry Out of StockSale Ballerina Blackout - loud bubblegum Sale Candy Venom - electric pink Sale Pumpkin Rose - rich marigold Sale Tiger Tini - exotic orange Sale Saw-C - exotic tangerine Sale Up 2 No Good - nude peach Out of StockSale S1ngle - blushing nude Out of StockSale I Quit - true mink Out of StockSale Freckle Fiesta - spiced terracotta Sale Shawty - warm chestnut Sale PMS - moody brown Sale Turks & Caicos - deep teal Sale Midnight Wasabi - wicked green Sale Ya Dig?! - periwinkle blue Sale Clapback - true navy Sale Violet Fury - vivid violet Sale One Of The Boyz - wild lilac Sale Griselda - bold burgundy Sale F'N Black - navy black Out of StockSale Spanked - dusty rose Out of StockSale Thicc - sultry mauve Out of StockSale Dragon Mami - tropical papaya Sale Ma'Damn - royal red Out of StockSale Flamingo Acid - bright berry Out of StockSale Ballerina Blackout - loud bubblegum Sale Candy Venom - electric pink Sale Pumpkin Rose - rich marigold Sale Tiger Tini - exotic orange Sale Saw-C - exotic tangerine Sale Up 2 No Good - nude peach Out of StockSale S1ngle - blushing nude Out of StockSale I Quit - true mink Out of StockSale Freckle Fiesta - spiced terracotta Sale Shawty - warm chestnut Sale PMS - moody brown Sale Turks & Caicos - deep teal Sale Midnight Wasabi - wicked green Sale Ya Dig?! - periwinkle blue Sale Clapback - true navy Sale Violet Fury - vivid violet Sale One Of The Boyz - wild lilac Sale Griselda - bold burgundy Sale F'N Black - navy black Out of StockSale
1725639,HUDA BEAUTY,False Eyelashes,Classic False Lashes,no size,4.0,859,162700,20.0,20.0,https://www.sephora.com/product/classic-false-lashes-P402036?icid2=products grid:p402036,True,exclusive,no options,"What it is:
A set of durable- faux lashes for all eye styles with unique shapes that accentuate makeup and can be worn up to 15 times.

What it does:
Accessorize every makeup look with these gorgeous lashes. Huda Beauty Classic False Lashes are a cult favorite and come in an array of sophisticated designs—from Giselle to Lana. Made of synthetic mellow fibers- these high-quality lashes are very durable- and do not need mascara. 

What else you need to know:
These lashes are cruelty-free- and made from synthetic mellow fibers and a cotton band. Huda Beauty Classic False Lashes were created by lash guru and leading beauty personality- Huda Kattan.

Giselle #1: Light volume- natural style lashes that create a subtle- beautiful appearance while creating the illusion of a thicker lash line.
Claudia #6: Light volume- natural-looking lashes that are crisscrossed and very feathery to bring a smoky effect to the lash line—achieving a dramatic appearance that emphasizes most makeup looks.
Samantha #7: Medium volume- natural style lashes that are stacked up to create length and drama for every eye shape.
Scarlett #8: High volume style lashes that combine bold length and curl to bring out bold makeup looks.
Carmen #9: High volume- dramatic style lashes with a mink-like featheriness at the ends—creating serious drama with the softness- while being not too long or distracting.
Lana #10: High volume- lengthening lashes that accentuate a smoky eye or bold liner- providing ultimate drama and extreme length.
Sasha #11: Medium volume lashes that deliver subtle drama- and they’re light in density and slightly longer in length.
","Suggested Usage:
-Remove from packaging.
-Wiggle band to loosen.
-Measure against eye.
-Trim to fit.
-Apply glue.
-Apply lashes."," -Mellow Fibers: For lash follicles.
-Cotton Band",0,1,0,0,Makeup,"Giselle #1  - light volume, natural style   Claudia #6 - light volume, natural style   Samantha #7 - medium volume, natural style   Scarlett #8 - high volume, dramatic style   Carmen #9 - high volume, dramatic style   Lana #10 - high volume, lengthening style  Only a few left Sasha #11 - medium volume,  natural style  "
