id,brand,category,name,size,rating,number_of_reviews,love,price,value_price,URL,MarketingFlags,MarketingFlags_content,options,details,how_to_use,ingredients,online_only,exclusive,limited_edition,limited_time_offer,Fam_Category,Shades
1943521,SEPHORA COLLECTION,Eyeshadow,Colorful Eyeshadow,0.042 oz/ 1.2 g,4.0,1000,169300,9.0,9.0,https://www.sephora.com/product/colorful-shadow-P430932?icid2=products grid:p430932,True,exclusive,no options,What it is: A collection of over 80 eye shadows in four finishes: glitter- metallic- matte- and shimmer.Ingredient Callouts: This product is cruelty-free.What Else You Need to Know: For matte and shimmer finishes- shadows are best applied with finger or brush. For metallic finish- best application is with finger. For glitter finish- best application is with brush.,Suggested Usage:-For an intense look- apply directly to eyelids with fingers. -For a softer look or to blend out shadow- use a shadow brush that works with cream shadows.,Mica- Polyethylene Terephthalate- Talc- Magnesium Myristate- Ci 77891 (Titanium Dioxide)- Octyldodecyl Stearoyl Stearate- Polyglyceryl-3 Diisostearate- Isostearyl Neopentanoate- Polybutene- Calcium Sodium Borosilicate- Ci 77491 (Iron Oxides)- Phenoxyethanol- Maltodextrin- Polyurethane-11- Ci 77007 (Ultramarines)- Sorbic Acid- Silica- Ci 77492 (Iron Oxides)- Bht- Ci 19140 (Yellow 5 Lake)- Ci 77499 (Iron Oxides)- Ci 77000 (Aluminum Powder)- Tin Oxide- Camellia Sinensis Leaf Extract- Ci 77742 (Manganese Violet)- Ci 42090 (Blue 1 Lake).,0,1,0,0,Makeup,"13 Diamond Crushed   12 Glitter Fever   205 Ballet shoes   232 Girl Talk   326 Let's party   362 Twinkle twinkle  Out of Stock 258 Smell of roses   356 Sweet Lollipop!   234 Fairy princess   361 Unicorn dust   357 Glitter dress  Out of Stock 367 Shooting star   340 Jump into the mud  Out of Stock 343 In the woods  Out of Stock 27 Fool's Gold - rose gold  217 Walking In The Sand   220 Lucky Penny   292 Hollywood Calling  New 297 Choco Excess   386 Break The Bank   388 One In A Million   28 It's Cherry   387 Playing With Fire   09 Go Green   07 Volcano Land   06 Gold Digger   05 Mete'or   04 Burgundy Gang   01 To The Moon And Back   14 Sunbeam - light gold  15 Pyramid - bronze  17 Lunar Eclipse - midnight blue  19 Oh Baby - light pink  24 Mirage - two-tone  25 Truffle - black  02 Milky Way   08 Shock Choc   29 First Light   31 Demanding   33 Fantasia   201 Let It Snow   207 Lazy afternoon   206 Secret boudoir   328 Natural beauty   282 My dear nude   351 Golden marshmellow   332 Flawless   353 Chou a la crème   352 Mocha latte   229 Scented candle   259 Strawberry macaroon   324 Morning sunrise   327 Sand dunes   339 Sweet brownie   299 Coffee break   302 Roasted chestnuts   346 Hurricane wave   360 About last night   304 Black lace   347 Wild island  Out of Stock 337 Dark Ocean  Out of Stock 253 Surfin USA   318 Very bad  Out of Stock 334 Fairy dusty   330 Mystic queen   210 Sunset at the beach   216 Girl night out   217 Walking in the sand   225 Morning freshness   260 Sweet candy   341 Magnolia garden   348 Catch the moon   359 Antique copper   291 Copper rush   338 Radiant sand   285 Tahitian pearl  Out of Stock 298 Tiramisu   364 Cherry blossom   368 Vampire lovers   344 Make a wish   349 Starry night  Out of Stock 329 Be chic   345 Go wild   275 Sir yes sir!   277 Stadium fever   254 Diving In   335 Dear Cactus   204 Under The Cover  New 211 Blonde Ambition  New 227 Romantic Comedy  New 257 No Place Like Home  New 281 Satin Corset  New 365 Glazed Donut  New 371 Wine O'Clock   372 Champagne, Please!   373 Cinnamon   374 Prom Date   375 Semi-Sweet Chocolate   377 Espresso   378 Soft Suede   379 Spiced Plum   380 Perfectly Pink  New 381 Golden Bronze   382 Into The Sunset   383 Astral Blue   384 Emerald   223 Hippie Girl  New 13 Diamond Crushed   12 Glitter Fever   09 Go Green   07 Volcano Land   06 Gold Digger   05 Mete'or   04 Burgundy Gang   01 To The Moon And Back   205 Ballet shoes   232 Girl Talk   326 Let's party   362 Twinkle twinkle  Out of Stock 258 Smell of roses   356 Sweet Lollipop!   234 Fairy princess   361 Unicorn dust   357 Glitter dress  Out of Stock 367 Shooting star   340 Jump into the mud  Out of Stock 343 In the woods  Out of Stock 201 Let It Snow   207 Lazy afternoon   206 Secret boudoir   328 Natural beauty   282 My dear nude   351 Golden marshmellow   332 Flawless   353 Chou a la crème   352 Mocha latte   229 Scented candle   259 Strawberry macaroon   324 Morning sunrise   327 Sand dunes   339 Sweet brownie   299 Coffee break   302 Roasted chestnuts   346 Hurricane wave   360 About last night   304 Black lace   347 Wild island  Out of Stock 337 Dark Ocean  Out of Stock 253 Surfin USA   318 Very bad  Out of Stock 334 Fairy dusty   330 Mystic queen   210 Sunset at the beach   216 Girl night out   217 Walking in the sand   225 Morning freshness   260 Sweet candy   341 Magnolia garden   348 Catch the moon   359 Antique copper   291 Copper rush   338 Radiant sand   285 Tahitian pearl  Out of Stock 298 Tiramisu   364 Cherry blossom   368 Vampire lovers   344 Make a wish   349 Starry night  Out of Stock 329 Be chic   345 Go wild   275 Sir yes sir!   277 Stadium fever   254 Diving In   335 Dear Cactus   14 Sunbeam - light gold  15 Pyramid - bronze  17 Lunar Eclipse - midnight blue  19 Oh Baby - light pink  24 Mirage - two-tone  25 Truffle - black  27 Fool's Gold - rose gold  217 Walking In The Sand   220 Lucky Penny   292 Hollywood Calling  New 297 Choco Excess   386 Break The Bank   388 One In A Million   02 Milky Way   08 Shock Choc   29 First Light   31 Demanding   33 Fantasia   28 It's Cherry   204 Under The Cover  New 211 Blonde Ambition  New 227 Romantic Comedy  New 257 No Place Like Home  New 281 Satin Corset  New 365 Glazed Donut  New 371 Wine O'Clock   372 Champagne, Please!   373 Cinnamon   374 Prom Date   375 Semi-Sweet Chocolate   377 Espresso   378 Soft Suede   379 Spiced Plum   380 Perfectly Pink  New 381 Golden Bronze   382 Into The Sunset   383 Astral Blue   384 Emerald   223 Hippie Girl  New 387 Playing With Fire  "
1686211,SEPHORA COLLECTION,Concealer,Bright Future Gel Serum Concealer,0.13 oz/ 3.8 mL,4.0,2000,124900,14.0,14.0,https://www.sephora.com/product/bright-future-gel-serum-concealer-P398009?icid2=products grid:p398009,True,exclusive,no options,What it is: A gel-serum concealer that provides smooth- undetectable coverage- plus has pineapple ceramides to help improve texture and add brightness.Coverage: Medium Finish: NaturalFormulation: LiquidSkin Type: Normal- Dry- Combination- and Oily Highlighted Ingredients: -Pineapple Ceramide: Improves texture and adds brightness.What Else You Need to Know: This smooth- easy-to-blend formula instantly corrects and covers discoloration and darkness under eyes and pigmentation on the face. The lightweight cream formula won't settle in lines- making it the perfect concealer for redness around the nose. It is also infused with treatment to help correct and smooth skin.Ingredient Note: All Sephora Collection products comply with the most rigorous international laws on product safety—going beyond satisfying European and US Cosmetics regulations. They also satisfy the strictest internal requirements of development- quality- traceability- and safety- and lead by example with a Restricted Substance List that excludes more than 1-400 substances.,Suggested Usage:-Dip- dot and blend: Apply three dots of product- using the spongey- swab-like applicator for the ideal amount of product. -For best results- apply product to moisturized skin and/or under eye area.,Water- Cyclopentasiloxane- Triethylhexanoin - Dimethicone- Isododecane- Butylene Glycol- PEG-10 Dimethicone- Phenyl Trimethicone- Silica- Disteardimonium Hectorite- PEG-30 Dipolyhydroxystearate- Trimethylsiloxysilicate- Ethylene Brassylate- Triethoxycaprylylsilane- Lauryl PEG-9 Polydimethylsiloxyethyl Dimethicone - Propylene Carbonate- Phenoxyethanol- Polyhydroxystearic Acid- Caprylyl Glycol- Glycerin- Galactoarabinan- Glyceryl Polyacrylate- 1-2-Hexanediol- Tocopherol- Tetrahexyldecyl Ascorbate. May Contain: CI 77891 (Titanium Dioxide)- CI 77491/CI 77492/CI 77499 (Iron Oxides).,0,1,0,0,Makeup,"01 Bavarian cream - light, neutral with yellow undertone  02 Meringue - light with neutral undertone   03 Fondant - light with neutral undertone  04 Butter Cream - light with neutral undertone  05 Parfait - medium, neutral with pink undertone  06 Madeleine - for light skin with yellow undertones New 07 Custard - medium with neutral undertone  7.5 Biscotti - for light skin with peach undertones New 08 Palmier - medium with yellow undertone  09 Sable - medium with neutral undertone  10 Eclair - medium neutral with yellow undertone  10.5 Blondie - medium with yellow undertone  11 Tatin - tan with yellow undertone  11.5 Butterscotch - tan with yellow undertone  12 Pecan Pie - tan with yellow undertone  12.5 Praline - for medium to tan skin with pink undertones New 13 Creme Caramel - tan with yellow undertone  13.5 Ginger Snap - for tan skin with neutral undertones New 14 Toffee - tan with neutral undertone  15 Dulce De Leche - for tan to deep skin with golden yellow undertones New 16 Pot De Creme - deep with neutral undertone  17 Chocolate souffle - deep with pink undertone  18 Ganache - for deep skin with neutral undertones New 19 Truffle - deep with neutral undertone   20 Devil's Food - deep, neutral with pink undertone  21 Haute Cocoa - deep with pink undertone   01 Bavarian cream - light, neutral with yellow undertone  02 Meringue - light with neutral undertone   03 Fondant - light with neutral undertone  04 Butter Cream - light with neutral undertone  05 Parfait - medium, neutral with pink undertone  06 Madeleine - for light skin with yellow undertones New 07 Custard - medium with neutral undertone  7.5 Biscotti - for light skin with peach undertones New 08 Palmier - medium with yellow undertone  09 Sable - medium with neutral undertone  10 Eclair - medium neutral with yellow undertone  10.5 Blondie - medium with yellow undertone  11 Tatin - tan with yellow undertone  11.5 Butterscotch - tan with yellow undertone  12 Pecan Pie - tan with yellow undertone  12.5 Praline - for medium to tan skin with pink undertones New 13 Creme Caramel - tan with yellow undertone  13.5 Ginger Snap - for tan skin with neutral undertones New 14 Toffee - tan with neutral undertone  15 Dulce De Leche - for tan to deep skin with golden yellow undertones New 16 Pot De Creme - deep with neutral undertone  17 Chocolate souffle - deep with pink undertone  18 Ganache - for deep skin with neutral undertones New 19 Truffle - deep with neutral undertone   20 Devil's Food - deep, neutral with pink undertone  21 Haute Cocoa - deep with pink undertone  "
1991231,SEPHORA COLLECTION,Lip Gloss,Ultra Shine Lip Gloss,0.11 oz/ 3.1 g,4.5,3000,172700,12.0,12.0,https://www.sephora.com/product/ultra-shine-lip-gloss-P266811?icid2=products grid:p266811,True,exclusive,no options,What it is: A collection of gel lip glosses with plumped-up- light-reflecting shine inspired by gel nail polishes.What it does: Ultra Shine Lip Gels feature a light texture that transforms lips with plumped-up shine and moisture.What else you need to know:This product is not tested on animals.,Suggested Usage:-Apply all over the lips or dab on over lipstick to boost shine.,Polybutene- Hydrogenated Polyisobutene- Triisodecyl Trimellitate- Paraffinum Liquidum (Mineral Oil)- Cera Microcristallina (Microcrystalline Wax)- Silica Dimethyl Silylate- Dextrin Palmitate- Ethylene/Propylene/Styrene Copolymer- Ethylhexyl Methoxycinnamate- Parfum (Fragrance)- CI 77891 (Titanium Dioxide)- Synthetic Fluorphlogopite- Octyldodecanol- Pentaerythrityl Tetra-Di-T-Butyl Hydroxyhydrocinnamate- Butylene/Ethylene/Styrene Copolymer- Ethylhexyl Salicylate- Saccharin- Butyl Methoxydibenzoylmethane- CI 77491 (Iron Oxides)- BHT- CI 77492 (Iron Oxides)- CI 75470 (Carmine).  ,0,1,0,0,Makeup,04 Totally Lucid  - high shine clear  06 Natural Look - high shine peach nude  01 Perfect Nude - high shine classic nude  03 Rose Petal - high shine dusty rose  08 Glossy Cherry - high shine classic red  09 Soft Fuchsia - high shine fuchsia  22 Baby Doll - high shine peony pink  10 Flashy Day - high shine hot pink red  14 Vampire Lips - high shine bright red  15 Dark Nude - high shine deep nude  16 Red Sand - high shine nude rosewood  17 Browny Touch - high shine cool brown  18 Red Velvet - high shine burgundy red  19 Marshmallow - high shine magenta pink  20 Cotton Floss - high shine cool pink  23 Autumn Mood - high shine rich red  24 Precious Ruby - high shine deep ruby  25 Melted Pink - high shine purple pink  27 Mystic Pink - high shine classic pink  02 Deep Rose - shimmer dark rose with gold pearl  21 Fresh Peach - shimmer pink peach with gold pearl  07 Pink Crystal - shimmer pale pink with white pearl  05 Bubble Gum - shimmer baby pink white pearl  26 Rock Purple - shimmer bold purple with gold pearl  04 Totally Lucid  - high shine clear  06 Natural Look - high shine peach nude  01 Perfect Nude - high shine classic nude  03 Rose Petal - high shine dusty rose  02 Deep Rose - shimmer dark rose with gold pearl  21 Fresh Peach - shimmer pink peach with gold pearl  07 Pink Crystal - shimmer pale pink with white pearl  08 Glossy Cherry - high shine classic red  09 Soft Fuchsia - high shine fuchsia  22 Baby Doll - high shine peony pink  10 Flashy Day - high shine hot pink red  05 Bubble Gum - shimmer baby pink white pearl  14 Vampire Lips - high shine bright red  15 Dark Nude - high shine deep nude  16 Red Sand - high shine nude rosewood  17 Browny Touch - high shine cool brown  18 Red Velvet - high shine burgundy red  19 Marshmallow - high shine magenta pink  20 Cotton Floss - high shine cool pink  23 Autumn Mood - high shine rich red  24 Precious Ruby - high shine deep ruby  25 Melted Pink - high shine purple pink  26 Rock Purple - shimmer bold purple with gold pearl  27 Mystic Pink - high shine classic pink 
2148385,SEPHORA COLLECTION,Lipstick,#LIPSTORIES Lipstick,0.14 oz/ 4 g,4.5,2000,272400,9.0,9.0,https://www.sephora.com/product/lipstories-lipstick-P424915?icid2=products grid:p424915,True,exclusive,no options,"#LIPSTORIES This is lipstick for real life- not just ring lights—lipsticks for celebrating the wild adventures- best moments- and magical memories in your life. So grab a shade or four and take your lipstick outside. See you out there! What it is:A high-pigment- lightweight lipstick that provides full-coverage color in one swipe. Available in 40 shades and three finishes: matte- cream- and metal.  Here are our stories:FESTIVAL VIBES: Whether you’re with the band or waiting in the GA line- these shades scream ""FESTIVAL-READY."" 23 After Hours | 39 Desert Trip | 42 No Cell Service | 50 TrippinPOOL O’CLOCK:From poolside hangs to permanent brunch- these bright shades will see you through every summertime situation. 12 Celebrate | 37 Hot in Havana | 28 Popsicle Lips | 13 Coconut GroveTell us your #LIPSTORIES on Instagram and tag us @SC! ",no instructions,unknown,0,1,0,0,Makeup,7 Love Love  - matte sand nude  1 Brunch Date  - matte pink nude  12 Celebrate  - matte fucschia  23 After Hours  - matte red  22 A Little Magic  - matte classic red  9 Labyrinth City   - matte soft mauve red  31 Golden Gate  - matte berry  33 Wanderlust - satin rich berry  38 Off-Limits - matte grey purple  45 City Beat - matte navy blue  58 But First… Coffee! - matte rich chocolate brown  59 Vacation Goals - matte taupe  70 Margs - matte dollar bill green  56 5-0 Grind - matte electric purple  65 Spiked! - matte mauve pink  63 Adventuring - matte rusctic orange nude  62 Palm Street - matte red orange  27 Hong Kong By Night  - metallic red with gold sparkle  51 Festival Lights  - metallic bronze with gold sparkle  41 Take A Spin - metallic nude with champagne sparkle  48 Just Add Tinsel   - metallic silver with white sparkle Out of Stock 67 Sink Or Swim - metallic baby pink with pink sparkle  71 Treat Yo Self - metallic yellow gold with gold sparkle  68 Spark - metallic rosewood with pink sparkle  57 It'S Electric - metallic purple black with pink sparkle  69 Werk It - metallic white with pink sparkle  60 Backstage - metallic gunmetal with grey sparkle  4 Somewhere In Spain  - satin sand nude  6 Tan Lines  - satin cool nude  3 Oui ! - satin nude baby pink  10 Yum Yum  - satin red brown  30 Matinée  - satin rosewood  36 Spring Break - satin nude pink  37 Hot In Havana  - satin orange  28 Popsicle Lips  - satin raspberry  21 Pineapple Express - satin hot pink  32 Berry-Licious  - satin bright berry  29 Malt Shake  - satin burgundy  11 Fire Side  - satin black brown  47 Cash Money  - satin forest green  64 Room Service - satin peach pink  66 Offshore - matte classic brick red  61 Snuggle Weather - satin milk chocolate  7 Love Love  - matte sand nude  1 Brunch Date  - matte pink nude  12 Celebrate  - matte fucschia  23 After Hours  - matte red  22 A Little Magic  - matte classic red  9 Labyrinth City   - matte soft mauve red  31 Golden Gate  - matte berry  33 Wanderlust - satin rich berry  38 Off-Limits - matte grey purple  45 City Beat - matte navy blue  27 Hong Kong By Night  - metallic red with gold sparkle  51 Festival Lights  - metallic bronze with gold sparkle  41 Take A Spin - metallic nude with champagne sparkle  48 Just Add Tinsel   - metallic silver with white sparkle Out of Stock 4 Somewhere In Spain  - satin sand nude  6 Tan Lines  - satin cool nude  3 Oui ! - satin nude baby pink  10 Yum Yum  - satin red brown  30 Matinée  - satin rosewood  36 Spring Break - satin nude pink  37 Hot In Havana  - satin orange  28 Popsicle Lips  - satin raspberry  21 Pineapple Express - satin hot pink  32 Berry-Licious  - satin bright berry  29 Malt Shake  - satin burgundy  11 Fire Side  - satin black brown  47 Cash Money  - satin forest green  58 But First… Coffee! - matte rich chocolate brown  59 Vacation Goals - matte taupe  67 Sink Or Swim - metallic baby pink with pink sparkle  71 Treat Yo Self - metallic yellow gold with gold sparkle  68 Spark - metallic rosewood with pink sparkle  70 Margs - matte dollar bill green  56 5-0 Grind - matte electric purple  57 It'S Electric - metallic purple black with pink sparkle  69 Werk It - metallic white with pink sparkle  60 Backstage - metallic gunmetal with grey sparkle  65 Spiked! - matte mauve pink  63 Adventuring - matte rusctic orange nude  64 Room Service - satin peach pink  66 Offshore - matte classic brick red  61 Snuggle Weather - satin milk chocolate  62 Palm Street - matte red orange 
1691278,SEPHORA COLLECTION,Lip Liner,Rouge Gel Lip Liner,0.0176 oz/ 0.5 g,4.5,810,76200,13.0,13.0,https://www.sephora.com/product/rouge-gel-lip-liner-P401715?icid2=products grid:p401715,True,exclusive,no options,"What it is:
 A retractable lip liner with a long-lasting- gel-cream texture to enhance the lip contour.

What it does:
This first-to-market creamy gel lip liner is softer than a traditional liner. It is formulated with a gel-cream finish for an enhanced- smooth look without dullness. The unique- soft texture of the non-drying formula glides over every curve with ease to create a fuller look and a color-matched base for lipsticks. The liner also comes with a built-in sharpener for easy application anywhere.

What it is formulated WITHOUT:
- Parabens

Beauty Tip:
Enhance the look of lips with the new range of highlighting lip liners in champagne- pearl- and gold. Add volume to lips by applying on the Cupid’s bow. 

What else you need to know:
 All shades were specifically chosen to pair with existing top-selling #Lipstories and Cream lipsticks.
This product is not tested on animals.
Ingredient Note: 
All Sephora Collection products comply with the most rigorous international laws on product safety—going beyond satisfying European and US Cosmetics regulations. They also satisfy the strictest internal requirements of development- quality- traceability- and safety- and lead by example with a Restricted Substance List that excludes more than 1-400 substances.","Suggested Usage:
-Apply first to the outer lines of lips to create the perfect contour. 
-For added benefit- gradually fill in color all over lips to create the perfect lip base for any Rouge Cream or Shine lipstick. 
-Use the included built-in sharpener at the base of each pencil before pencil use.

 Precautions:
-Make sure to close the cap tightly to prevent premature drying of this creamy formula. -The creamy texture of this formula is unlike any lip liners on the market. It is imperative that you are gentle when applying lip pencil to lips as the tips are super soft and will bend with too much force. 


",Polyglyceryl-2 Triisostearate- Paraffin- Polybutene- Phytosteryl/Isostearyl/Cetyl/Stearyl/Behenyl Dimer Dilinoleate- Ozokerite- Ceresin- Microcrystalline Wax- Hydrogenated Vegetable Oil- Beeswax- Hydrogenated Palm Acid- Stearyl Stearate- BHT. (+/-) : CI 77891 (Titanium Dioxide)- CI 77491/CI 77492/CI 77499 (Iron Oxides)- CI 15850 (Red 6 Lake/Red 7 Lake)- CI 42090 (Blue 1 Lake)- CI 19140 (Yellow 5 Lake)- CI 45410 (Red 28 Lake)- CI 15985 (Yellow 6 Lake)- CI 17200 (Red 33 Lake).,0,1,0,0,Makeup,05 melon-choly  - matte melon pink Sale 14 aubergine dream - matte plum Sale 20 cosmo - matte magenta Sale 26 a little rusty - matte burgundy Sale 37 loud mouth - matte violet Sale 33 let's get lost - matte peach Sale 01 the nudest  - matte cool nude  02 nothin' but nude - matte true nude  03 rose wine - matte pinkish brown  04 creme de la creme  - matte peachy nude  07 dragon fruit - matte fuschia  08 cashmere pink - matte pink mauve  09 nectarine  - matte coral  10 cactus flower  - matte bright orange  11 it's cherry - matte true blue red  12 the red - matte true red  13 wine-o - matte berry wine  15 rosewood - matte mauve brown  16 mesquite  - matte chestnut brown  17 molasses - matte dark chocolate brown  18 dark horse - matte very deep plum  22 mid day rosé - matte rose pink  23 pardon my french - matte berry  24 rum raisin - matte mauve brown  25 bellflower - matte lilac  38 Voodoo - matte light purple  36 wild at heart - matte red nude  35 bad apple - matte rust  32 hot sauce - matte dirty rose  31 monarch - matte beige brown  29 dressed to the 90s - matte purple brown  28 sink or suede - matte pink brown  27 knock on wood - matte golden brown  01 the nudest  - matte cool nude  02 nothin' but nude - matte true nude  03 rose wine - matte pinkish brown  04 creme de la creme  - matte peachy nude  07 dragon fruit - matte fuschia  08 cashmere pink - matte pink mauve  09 nectarine  - matte coral  10 cactus flower  - matte bright orange  11 it's cherry - matte true blue red  12 the red - matte true red  13 wine-o - matte berry wine  15 rosewood - matte mauve brown  16 mesquite  - matte chestnut brown  17 molasses - matte dark chocolate brown  18 dark horse - matte very deep plum  22 mid day rosé - matte rose pink  23 pardon my french - matte berry  24 rum raisin - matte mauve brown  25 bellflower - matte lilac  38 Voodoo - matte light purple  36 wild at heart - matte red nude  35 bad apple - matte rust  32 hot sauce - matte dirty rose  31 monarch - matte beige brown  29 dressed to the 90s - matte purple brown  28 sink or suede - matte pink brown  27 knock on wood - matte golden brown  05 melon-choly  - matte melon pink Sale 14 aubergine dream - matte plum Sale 20 cosmo - matte magenta Sale 26 a little rusty - matte burgundy Sale 37 loud mouth - matte violet Sale 33 let's get lost - matte peach Sale
